{
  "$schema": "https://json-schema.org/draft-07/schema#",
  "$id": "https://judge.vtesitaly.com/data/judges.schema.json",
  "title": "VTES Italy — Judge italiani",
  "description": "Snapshot della lista judge VEKN filtrata per l'Italia. Generato da scripts/fetch-judges.mjs.",
  "type": "object",
  "additionalProperties": false,
  "required": ["source", "country", "generated_at", "judges"],
  "properties": {
    "source": {
      "type": "string",
      "format": "uri",
      "description": "URL della pagina da cui è stato estratto lo snapshot (directory dei judge su vtesexams.com)."
    },
    "country": {
      "type": "string",
      "minLength": 1,
      "description": "Paese per cui è filtrato lo snapshot."
    },
    "generated_at": {
      "type": "string",
      "pattern": "^\\d{4}-\\d{2}-\\d{2}T\\d{2}:\\d{2}:\\d{2}Z$",
      "description": "Timestamp UTC dell'ultimo cambiamento effettivo della lista."
    },
    "judges": {
      "type": "array",
      "items": { "$ref": "#/definitions/judge" }
    }
  },
  "definitions": {
    "judge": {
      "type": "object",
      "additionalProperties": false,
      "required": ["name", "vekn_id", "rank", "valid_from", "valid_to"],
      "properties": {
        "name": { "type": "string", "minLength": 1 },
        "vekn_id": { "type": "string", "pattern": "^\\d+$" },
        "rank": { "type": "string", "minLength": 1 },
        "valid_from": { "type": "string", "pattern": "^\\d{4}-\\d{2}-\\d{2}$" },
        "valid_to": { "type": "string", "pattern": "^\\d{4}-\\d{2}-\\d{2}$" }
      }
    }
  }
}
